{
  "schema_version": 1,
  "record_id": "rec-research",
  "recorded_at_utc": "2026-10-21T00:00:00Z",
  "request": {"request_id": "req-1", "sibling_record_ids": []},
  "classification": "RESEARCH_REVIEW",
  "target": {"kind": "JSON", "identifiers": ["research-runs/example/synthesis-snapshot.json"], "description": "Frozen synthesis snapshot of an example research run"},
  "requested_decision": "Decide whether the cited evidence supports the synthesized market claims",
  "decision_aspects": ["RESEARCH_EVIDENCE", "RESEARCH_CONCLUSIONS"],
  "scope": {"included": ["claims listed in the frozen snapshot"], "excluded": []},
  "evidence_references": [{"kind": "SNAPSHOT", "ref": "research-runs/example/synthesis-snapshot.json"}],
  "prerequisites": [{"id": "PREPARE_REVIEW_PERMIT", "description": "prepare-review emitted REVIEW_DISPATCH_ALLOWED", "status": "MET"}],
  "dispatch_disposition": "DISPATCH_PERMITTED",
  "class_fields": {
    "prepare_review": {
      "gate_result": "PASSED",
      "permit": {"path": "research-runs/example/review-permit.json", "permit_payload_sha256": "abababababababababababababababababababababababababababababababab", "state": "REVIEW_DISPATCH_ALLOWED"},
      "checkpoint_output_ref": "research-runs/example/prepare-review.out"
    }
  }
}
